id,userId,date,journalEntry,emotionalTheme,memorableMoment,energyLevel,physicalTension,positiveExperience,emotionalNeed,heartWeather,energyDrain,copingMechanism,socialConnection
assessment_1763838093158_t26xlio7n,user_1763838092884_5ifin4awb,2025-11-22T19:01:33.134Z,,Happy and joyful,Great time with family,8,Relaxed,Achieved a goal,Connection,Sunny and bright,None,Meditation,9
assessment_1763840098099_265za2hyj,user_1763838457551_tlu5vzuu8,2025-11-22T19:34:58.096Z,,lonely,failing my exam,3,"very tense ",nothing,"when i got my report card ",cloudy,failing my exam,noting,1
assessment_1763843097810_11cf3kk6p,user_1763838457551_tlu5vzuu8,2025-11-22T20:24:57.808Z,,,,,,,,,,,
assessment_1763843646938_oshrskj0h,user_1763838457551_tlu5vzuu8,2025-11-22T20:34:06.937Z,,Hopeful and optimistic,Today is very nice. It's been a while. I did a hackathon and then we went to the mental health checker. So I'm very excited.,4,,"I met 2 new friends ",,,,,
assessment_1763843684984_m4bqhvtzm,user_1763838457551_tlu5vzuu8,2025-11-22T20:34:44.983Z,,,,,,,,,,,
assessment_1763843812570_yigh0248k,user_1763838457551_tlu5vzuu8,2025-11-22T20:36:52.567Z,,Hopeful and optimistic,"It was a happy day, we had a hackathon and we built a mental health tracker.",4,,"I met two new friends today, so it was really good communicating and networking.",,,,,
assessment_1763844812477_pnl90zb3y,user_1763838457551_tlu5vzuu8,2025-11-22T20:53:32.474Z,"I went to a hackathon and I did some coding, I built a tool, I connected with some friends, it was really cool",Happy and joyful,I was able to successfully complete the project.,5,,new friends that made me smile today.,,,,,